[
  {
    "source_id": "SRC_ASI_CONSERVATION_MANUAL_2020",
    "title": "Architectural Conservation: Principles and Practice in India",
    "publisher": "Archaeological Survey of India / INTACH",
    "year": 2020,
    "url": "https://intach.org/conservation-guidelines.php",
    "topic": "Lime mortar compatibility & stone heritage conservation",
    "claim_supported": "Use of Ordinary Portland Cement (OPC) on historic lime mortar masonry causes moisture entrapment, salt crystallization, and accelerated stone spalling."
  }
]
